{
  "_meta": {
    "project": "Sword of Vermilion Disassembly",
    "description": "Phase 2 task list: hardening the disassembly for randomizer, editor, and modding tooling. All Phase 1 cleanup (139 tasks) is complete.",
    "created": "2026-03-05",
    "phase": 2,
    "label_progress": "100% named (0 loc_ labels remain)",
    "phase1_commits": 398,
    "phase1_tasks_completed": 139
  },
  "schema_version": 2,
  "task_defaults": {
    "verify_steps": [
      "cmd //c verify.bat"
    ],
    "acceptance": [
      "Bit-perfect build: cmd //c verify.bat exits 0",
      "No hex-to-decimal conversions in dc.b/dc.w/dc.l tables",
      "New labels follow repo conventions; loc_ renames preserve original address in a comment",
      "New constants go in the appropriate split constants file (hw_constants, game_constants, sound_constants, or ram_addresses)"
    ],
    "editing_rules": [
      "Prefer symbolic constants for RAM and I/O addresses",
      "Prefer existing macros over repeated instruction sequences",
      "Avoid moving code across modules unless callers are updated and verify.bat remains bit-perfect",
      "Use Node.js for all scripting (no Python)"
    ]
  },
  "quality_gates": {
    "always": [
      "Run cmd //c verify.bat after any change",
      "If verify fails, fix cause; do not revert unrelated user changes",
      "Run tools/run_checks.js to verify linters pass"
    ],
    "before_refactors": [
      "Add/confirm label-level comments explaining invariants and expected register usage",
      "Confirm branches (BSR/BRA) remain in range or change to JSR/JMP",
      "Confirm all dc.* tables remain byte-identical (keep hex literals)"
    ]
  },
  "categories": {
    "comment_density": {
      "description": "Raise comment density in under-documented files. Target: 15%+ comment-only lines in code files, function headers on every exported routine.",
      "tasks": [
        {
          "id": "COMMENT-001",
          "title": "Document sram.asm (1.2% comment density)",
          "description": "sram.asm has only 4 comment lines in 324 lines of code. Add function headers with input/output registers, document SRAM layout and checksum algorithm ($8810 polynomial), annotate raw loop counts ($000D, $0015, $000F, $002F, $01FF, $014E, $029F) with their semantic meanings (data block sizes), and document raw SRAM struct offsets ($2(A0), $4(A0), $6(A0)).",
          "file": "src/sram.asm",
          "priority": "high",
          "effort": "medium",
          "current_comment_ratio": "1.2%",
          "target_comment_ratio": "15%+",
          "status": "done"
        },
        {
          "id": "COMMENT-002",
          "title": "Document magic.asm (1.9% comment density)",
          "description": "magic.asm has only 27 comment lines in 1405 lines. Misleading filename: it actually contains ending credits/outro rendering, staff credit strings, and epilogue scene code. Add function headers, document the VDP tilemap rendering for credits scrolling, explain raw tile attribute values ($A080, $C180, $84C0, $4002), and annotate the ~12 ORI.l #$40000003 VDP row-advance patterns.",
          "file": "src/magic.asm",
          "priority": "high",
          "effort": "large",
          "current_comment_ratio": "1.9%",
          "target_comment_ratio": "15%+",
          "status": "done"
        },
        {
          "id": "COMMENT-003",
          "title": "Document bossbattle.asm (3.7% comment density)",
          "description": "bossbattle.asm has only 29 comment lines in 780 lines. Contains wall tile offset tables, FP sprite positions, boss battle player initialization, and cave map code. Add function headers, document data table formats, annotate raw VDP longwords ($40AE0003, $60AE0003) and raw immediates ($0090, $85B7).",
          "file": "src/bossbattle.asm",
          "priority": "high",
          "effort": "medium",
          "current_comment_ratio": "3.7%",
          "target_comment_ratio": "15%+",
          "status": "done"
        },
        {
          "id": "COMMENT-004",
          "title": "Document items.asm (4.6% comment density)",
          "description": "items.asm has only 153 comment lines in 3339 lines. Contains the full item use system, shop buy/sell system, and dialogue state machine. Add function headers with register conventions, document the shop flow, explain the 6 instances of ANDI.l #$00FFFFFF (ROM address masking), and annotate raw struct offsets.",
          "file": "src/items.asm",
          "priority": "high",
          "effort": "large",
          "current_comment_ratio": "4.6%",
          "target_comment_ratio": "15%+",
          "status": "done"
        },
        {
          "id": "COMMENT-005",
          "title": "Document dungeon.asm (8.2% comment density)",
          "description": "dungeon.asm has 186 comment lines in 2257 lines. The first-person wall rendering system is complex. Document raw map sector stride offsets (-$30(A2), $30(A2), -$60(A2), $60(A2), -$1(A2)), annotate the ~13 raw VDP longwords, and add comments to the tile decompression and wall draw functions.",
          "file": "src/dungeon.asm",
          "priority": "medium",
          "effort": "large",
          "current_comment_ratio": "8.2%",
          "target_comment_ratio": "15%+",
          "status": "done"
        },
        {
          "id": "COMMENT-006",
          "title": "Document cutscene.asm (9.4% comment density)",
          "description": "cutscene.asm has 203 comment lines in 2169 lines. Contains prologue scenes and town tilemap rendering. Document the ~25+ raw VDP command longwords, explain raw tile attribute bases ($A300, $C180, $84C0, $E300), annotate raw immediates ($0300, $01FF, $0E00), and document the repeated ADDI.l #$00800000 VDP row-advance pattern.",
          "file": "src/cutscene.asm",
          "priority": "medium",
          "effort": "large",
          "current_comment_ratio": "9.4%",
          "target_comment_ratio": "15%+",
          "status": "done"
        },
        {
          "id": "COMMENT-007",
          "title": "Document enemy.asm (9.6% comment density)",
          "description": "enemy.asm has 347 comment lines in 3608 lines. Contains enemy AI, projectile systems, collision, and Boss 1's full state machine. Boss 1 AI has many raw velocity longwords ($FFFF8000, $FFFFC000, $FFFE0000, $00020000) and raw position values ($005A, $0060, $006E, $0070, $00DA, $00C8, $00AC) that need annotation.",
          "file": "src/enemy.asm",
          "priority": "medium",
          "effort": "large",
          "current_comment_ratio": "9.6%",
          "target_comment_ratio": "15%+",
          "status": "done"
        },
        {
          "id": "COMMENT-008",
          "title": "Document towndata.asm (9.9% comment density)",
          "description": "towndata.asm has 389 comment lines in 3922 lines. Starts mid-function (continuation from items.asm). Contains locked door data table (LockedDoorDataTable at line 119) as entirely raw bytes, town NPC data, cave events, and chest reward code. Document the locked door format and add per-entry annotations.",
          "file": "src/towndata.asm",
          "priority": "medium",
          "effort": "large",
          "current_comment_ratio": "9.9%",
          "target_comment_ratio": "15%+",
          "status": "done"
        }
      ]
    },
    "magic_numbers_phase2": {
      "description": "Replace remaining magic numbers with named constants across all files. Phase 1 covered core/vblank/states/init/battle_gfx; these are the remaining files.",
      "tasks": [
        {
          "id": "MAGICB-001",
          "title": "Define VDP_VRAM_ROW_STRIDE constant for $00800000 pattern",
          "description": "The pattern ADDI.l #$00800000, Dx (advance VDP write address by one nametable row) appears dozens of times across cutscene.asm, magic.asm, miscdata.asm, bossbattle.asm, dungeon.asm. Define VDP_VRAM_ROW_STRIDE equ $00800000 in hw_constants.asm and replace all instances.",
          "file": "hw_constants.asm + 5+ source files",
          "priority": "high",
          "effort": "medium",
          "estimated_instances": 30,
          "status": "done"
        },
        {
          "id": "MAGICB-002",
          "title": "Define ROM_ADDRESS_MASK constant for $00FFFFFF pattern",
          "description": "ANDI.l #$00FFFFFF, Dx (mask ROM address to 24-bit) appears 8+ times across items.asm, npc.asm, player.asm. Define ROM_ADDRESS_MASK equ $00FFFFFF in hw_constants.asm and replace all instances.",
          "file": "hw_constants.asm + 3+ source files",
          "priority": "high",
          "effort": "small",
          "estimated_instances": 8,
          "status": "done"
        },
        {
          "id": "MAGICB-003",
          "title": "Replace ~329 raw VDP command longwords with vdpCmd macro calls",
          "description": "~329 raw VDP command longwords (patterns like $4xxxxxxx, $6xxxxxxx, $7xxxxxxx) remain across all source files. The vdpCmd macro already exists in macros.asm. Systematically replace raw longwords with vdpCmd(addr, type) calls. Do file-by-file, verify bit-perfect after each.",
          "priority": "high",
          "effort": "very_large",
          "files_affected": [
            {
              "file": "src/cutscene.asm",
              "estimated": 25
            },
            {
              "file": "src/magic.asm",
              "estimated": 20
            },
            {
              "file": "src/miscdata.asm",
              "estimated": 20
            },
            {
              "file": "src/boss.asm",
              "estimated": 20
            },
            {
              "file": "src/dungeon.asm",
              "estimated": 13
            },
            {
              "file": "src/bossbattle.asm",
              "estimated": 8
            },
            {
              "file": "src/towndata.asm",
              "estimated": 10
            },
            {
              "file": "src/enemy.asm",
              "estimated": 15